{"schemaVersion":1,"runId":"018f06b5-3c8d-7b2a-9f35-8b3388a857a1","kind":"synthetic","startedAt":"2026-08-06T12:00:00Z","endedAt":"2026-08-06T12:01:00Z","sourceId":"source-1","dirty":false,"machine":{"hostname":"bench","os":"Linux","cpu":"x86_64","ramBytes":68719476736,"gpu":"RTX 4090","driverVersion":"580.1","kernel":"6.14.0"},"runtimes":{"python":"3.12.0","cuda":"12.8","pytorch":"2.8","node":"22.22.3","cudnn":"9.8.0"},"models":[{"id":"null","revision":"abc123","sha256":"aaaaaaaaaaaaaaaaaaaaaaaaaaaaaaaaaaaaaaaaaaaaaaaaaaaaaaaaaaaaaaaa","runtime":"python","precision":"fp16"}],"configId":"config-1","configSha256":"bbbbbbbbbbbbbbbbbbbbbbbbbbbbbbbbbbbbbbbbbbbbbbbbbbbbbbbbbbbbbbbb","datasetId":"dataset-1","datasetSha256":"cccccccccccccccccccccccccccccccccccccccccccccccccccccccccccccccc","seed":42,"command":["benchmark","run"],"environment":{"cudaVisibleDevices":"0"},"warmups":1,"repetitions":2,"randomization":{"method":"seeded-shuffle","blind":true,"revealLocked":true},"status":"passed","comparisonSemanticsSha256":"dddddddddddddddddddddddddddddddddddddddddddddddddddddddddddddddd","expectedItems":[{"sourceId":"fixture","candidateId":"null","attempt":1}]}
